{
  "description": "Default round stone.",
  "stone": {
    "shape": "round",
    "diameter": 6.5,
    "length": null,
    "width": null,
    "depth": 4.0,
    "orientation": 0.0
  },
  "generatedMetadata": {
    "shape": "round",
    "girdleRadiusMm": 3.25,
    "girdleZMm": 14.200000000000001,
    "crownHeightMm": 1.4,
    "pavilionHeightMm": 2.6,
    "tableRadiusMm": 1.8200000000000003,
    "lengthMm": 6.5,
    "widthMm": 6.5,
    "depthMm": 4.0,
    "orientationDeg": 0.0,
    "isGemologicalReproduction": false,
    "referenceGeometryVersion": "1.0.0"
  },
  "volumeMm3": 58.221419,
  "boundingBox": {
    "minMm": [
      -3.2500001,
      -3.2500001,
      11.599999900000002
    ],
    "maxMm": [
      3.2500001,
      3.2500001,
      15.6000001
    ]
  }
}
